{"version": "1.0", "metadata": {"title": "Most popular web browsers", "subtitle": "2000 - 2026", "language": "en", "durationSeconds": 238}, "canvas": {"width": 1280, "height": 720, "fps": 30}, "theme": {"background": "#ffffff", "surface": "#f4f5f7", "primaryText": "#111827", "secondaryText": "#6b7280", "mutedText": "#c8ccd4", "accent": "#e11d2e", "barTrack": "#eef0f3", "fontFamily": "Inter"}, "datasetRef": "dataset_most-popular-web-browsers-20260923094501", "scenes": [{"id": "scene_title", "type": "title", "duration": 8, "title": "Most popular web browsers", "subtitle": "2000 - 2026"}, {"id": "scene_intro", "type": "intro", "duration": 25, "title": "Most popular web browsers, 2000 to 2026.", "subtitle": "The full race, year by year \u2014 watch the rankings shift from 2000 to 2026."}, {"id": "scene_race_1", "type": "bar_race", "duration": 60, "datasetRef": "dataset_most-popular-web-browsers-20260923094501", "props": {"tapeRef": "frames.json", "topN": 10, "periodLabels": ["2000", "2001", "2002", "2003", "2004", "2005", "2006", "2007", "2008", "2009", "2010", "2011", "2012", "2013", "2014", "2015", "2016", "2017", "2018", "2019", "2020", "2021", "2022", "2023", "2024", "2025", "2026"], "highlights": [], "notes": ["560 bar-frames carry a held (non-observed) value forward; these are drawn for visual continuity only and are flagged held=true"], "summary": {"heading": "Most popular web browsers", "value": 68.6385, "entityName": "Chrome", "entityId": "chrome", "year": "2026", "unit": "percent", "entities": [{"id": "chrome", "name": "Chrome", "color": "#dc2626"}, {"id": "safari", "name": "Safari", "color": "#f59e0b"}, {"id": "edge", "name": "Edge", "color": "#0891b2"}]}, "tapeRange": [0, 199]}}, {"id": "scene_spotlight_2010", "type": "fact_box", "duration": 14, "title": "Internet Explorer rules the 2010s", "props": {"kicker": "THE 2010S", "atLabel": "2010", "body": "As the 2010s began, Internet Explorer led the world with 50.34%. Firefox was the previous decade's biggest climber, rising 13 places into the top 10.", "entityIds": ["internet-explorer", "firefox", "chrome"]}}, {"id": "scene_race_2", "type": "bar_race", "duration": 60, "datasetRef": "dataset_most-popular-web-browsers-20260923094501", "props": {"tapeRef": "frames.json", "topN": 10, "periodLabels": ["2000", "2001", "2002", "2003", "2004", "2005", "2006", "2007", "2008", "2009", "2010", "2011", "2012", "2013", "2014", "2015", "2016", "2017", "2018", "2019", "2020", "2021", "2022", "2023", "2024", "2025", "2026"], "highlights": [], "notes": ["560 bar-frames carry a held (non-observed) value forward; these are drawn for visual continuity only and are flagged held=true"], "summary": {"heading": "Most popular web browsers", "value": 68.6385, "entityName": "Chrome", "entityId": "chrome", "year": "2026", "unit": "percent", "entities": [{"id": "chrome", "name": "Chrome", "color": "#dc2626"}, {"id": "safari", "name": "Safari", "color": "#f59e0b"}, {"id": "edge", "name": "Edge", "color": "#0891b2"}]}, "tapeRange": [200, 399]}}, {"id": "scene_spotlight_2020", "type": "fact_box", "duration": 14, "title": "Chrome rules the 2020s", "props": {"kicker": "THE 2020S", "atLabel": "2020", "body": "As the 2020s began, Chrome led the world with 64.61%. Samsung Internet was the previous decade's biggest climber, rising 10 places into the top 10.", "entityIds": ["chrome", "safari", "firefox"]}}, {"id": "scene_race_3", "type": "bar_race", "duration": 42, "datasetRef": "dataset_most-popular-web-browsers-20260923094501", "props": {"tapeRef": "frames.json", "topN": 10, "periodLabels": ["2000", "2001", "2002", "2003", "2004", "2005", "2006", "2007", "2008", "2009", "2010", "2011", "2012", "2013", "2014", "2015", "2016", "2017", "2018", "2019", "2020", "2021", "2022", "2023", "2024", "2025", "2026"], "highlights": [], "notes": ["560 bar-frames carry a held (non-observed) value forward; these are drawn for visual continuity only and are flagged held=true"], "summary": {"heading": "Most popular web browsers", "value": 68.6385, "entityName": "Chrome", "entityId": "chrome", "year": "2026", "unit": "percent", "entities": [{"id": "chrome", "name": "Chrome", "color": "#dc2626"}, {"id": "safari", "name": "Safari", "color": "#f59e0b"}, {"id": "edge", "name": "Edge", "color": "#0891b2"}]}, "tapeRange": [400, 539]}}, {"id": "scene_ending", "type": "ending", "duration": 15, "title": "Internet Explorer starts first; Chrome ends first."}], "assets": [], "sources": [{"url": "http://localhost:8971/browsers.csv", "publisher": "browsers", "publishedAt": null, "retrievedAt": "2026-09-23T09:45:01.758Z", "identifier": "picked_http-localhost-8971-browsers-csv"}]}