{
  "version": "1.0",
  "metadata": {
    "title": "Best-Selling Game Consoles",
    "subtitle": "1984 - 2026",
    "language": "en",
    "durationSeconds": 238
  },
  "canvas": {
    "width": 1280,
    "height": 720,
    "fps": 30
  },
  "theme": {
    "background": "#ffffff",
    "surface": "#f8fafc",
    "primaryText": "#1f2937",
    "secondaryText": "#4b5563",
    "mutedText": "#9ca3af",
    "accent": "#7c3aed",
    "barTrack": "#e5e7eb",
    "fontFamily": "Inter, system-ui, sans-serif"
  },
  "datasetRef": "dataset_best-selling-game-consoles-20260925",
  "scenes": [
    {
      "id": "scene_title",
      "type": "title",
      "duration": 8,
      "datasetRef": "dataset_best-selling-game-consoles-20260925"
    },
    {
      "id": "scene_intro",
      "type": "intro",
      "duration": 25,
      "datasetRef": "dataset_best-selling-game-consoles-20260925",
      "props": {
        "title": "Best-Selling Game Consoles",
        "subtitle": "Cumulative units sold, 1984\u20132026"
      }
    },
    {
      "id": "scene_race_1",
      "type": "bar_race",
      "duration": 60,
      "datasetRef": "dataset_best-selling-game-consoles-20260925",
      "props": {
        "tapeRef": "frames.json",
        "topN": 10,
        "periodLabels": [
          "1984",
          "1985",
          "1986",
          "1987",
          "1988",
          "1989",
          "1990",
          "1991",
          "1992",
          "1993",
          "1994",
          "1995",
          "1996",
          "1997",
          "1998",
          "1999",
          "2000",
          "2001",
          "2002",
          "2003",
          "2004",
          "2005",
          "2006",
          "2007",
          "2008",
          "2009",
          "2010",
          "2011",
          "2012",
          "2013",
          "2014",
          "2015",
          "2016",
          "2017",
          "2018",
          "2019",
          "2020",
          "2021",
          "2022",
          "2023",
          "2024",
          "2025",
          "2026"
        ],
        "tapeRange": [
          0,
          430
        ],
        "highlights": [],
        "notes": [],
        "summary": ""
      }
    },
    {
      "id": "scene_spotlight_ps2",
      "type": "fact_box",
      "duration": 14,
      "datasetRef": "dataset_best-selling-game-consoles-20260925",
      "props": {
        "atLabel": "2000",
        "heading": "PlayStation 2 launches",
        "body": "Sony's PlayStation 2 arrives in 2000 and goes on to become the best-selling game console of all time at over 160 million units."
      }
    },
    {
      "id": "scene_race_2",
      "type": "bar_race",
      "duration": 60,
      "datasetRef": "dataset_best-selling-game-consoles-20260925",
      "props": {
        "tapeRef": "frames.json",
        "topN": 10,
        "periodLabels": [
          "1984",
          "1985",
          "1986",
          "1987",
          "1988",
          "1989",
          "1990",
          "1991",
          "1992",
          "1993",
          "1994",
          "1995",
          "1996",
          "1997",
          "1998",
          "1999",
          "2000",
          "2001",
          "2002",
          "2003",
          "2004",
          "2005",
          "2006",
          "2007",
          "2008",
          "2009",
          "2010",
          "2011",
          "2012",
          "2013",
          "2014",
          "2015",
          "2016",
          "2017",
          "2018",
          "2019",
          "2020",
          "2021",
          "2022",
          "2023",
          "2024",
          "2025",
          "2026"
        ],
        "tapeRange": [
          430,
          860
        ],
        "highlights": [],
        "notes": [],
        "summary": ""
      }
    },
    {
      "id": "scene_spotlight_wii",
      "type": "fact_box",
      "duration": 14,
      "datasetRef": "dataset_best-selling-game-consoles-20260925",
      "props": {
        "atLabel": "2006",
        "heading": "Nintendo's motion-control bet",
        "body": "The Wii's motion controls bring gaming to a whole new audience, selling over 100 million units."
      }
    },
    {
      "id": "scene_race_3",
      "type": "bar_race",
      "duration": 42,
      "datasetRef": "dataset_best-selling-game-consoles-20260925",
      "props": {
        "tapeRef": "frames.json",
        "topN": 10,
        "periodLabels": [
          "1984",
          "1985",
          "1986",
          "1987",
          "1988",
          "1989",
          "1990",
          "1991",
          "1992",
          "1993",
          "1994",
          "1995",
          "1996",
          "1997",
          "1998",
          "1999",
          "2000",
          "2001",
          "2002",
          "2003",
          "2004",
          "2005",
          "2006",
          "2007",
          "2008",
          "2009",
          "2010",
          "2011",
          "2012",
          "2013",
          "2014",
          "2015",
          "2016",
          "2017",
          "2018",
          "2019",
          "2020",
          "2021",
          "2022",
          "2023",
          "2024",
          "2025",
          "2026"
        ],
        "tapeRange": [
          860,
          1289
        ],
        "highlights": [],
        "notes": [],
        "summary": ""
      }
    },
    {
      "id": "scene_ending",
      "type": "ending",
      "duration": 15,
      "datasetRef": "dataset_best-selling-game-consoles-20260925"
    }
  ],
  "assets": [],
  "sources": [
    {
      "publisher": "Wikipedia / manufacturer reports",
      "url": "https://en.wikipedia.org/wiki/List_of_best-selling_game_consoles",
      "retrievedAt": "2026-09-25T00:00:00Z",
      "identifier": "wikipedia-best-selling-game-consoles"
    }
  ]
}