{
  "version": "1.0",
  "metadata": {
    "title": "World population by country",
    "subtitle": "1960 to 2024 population counts",
    "language": "en",
    "durationSeconds": 71.33
  },
  "canvas": {
    "width": 1280,
    "height": 720,
    "fps": 30
  },
  "theme": {
    "background": "#ffffff",
    "surface": "#f4f5f7",
    "primaryText": "#111827",
    "secondaryText": "#6b7280",
    "mutedText": "#c8ccd4",
    "accent": "#e11d2e",
    "barTrack": "#eef0f3",
    "fontFamily": "Inter"
  },
  "datasetRef": "dataset_world-population-by-country-20260921094702",
  "scenes": [
    {
      "id": "scene_title",
      "type": "title",
      "duration": 6,
      "title": "World population by country",
      "subtitle": "1960 to 2024 population counts"
    },
    {
      "id": "scene_intro",
      "type": "intro",
      "duration": 8,
      "title": "Tracking annual population counts from 1960 to 2024 reveals shifts in global leadership among nations.",
      "subtitle": "During this period, countries such as China and India held the highest population counts."
    },
    {
      "id": "scene_race",
      "type": "bar_race",
      "duration": 43.33,
      "datasetRef": "dataset_world-population-by-country-20260921094702",
      "props": {
        "tapeRef": "frames.json",
        "topN": 10,
        "periodLabels": [
          "1960",
          "1961",
          "1962",
          "1963",
          "1964",
          "1965",
          "1966",
          "1967",
          "1968",
          "1969",
          "1970",
          "1971",
          "1972",
          "1973",
          "1974",
          "1975",
          "1976",
          "1977",
          "1978",
          "1979",
          "1980",
          "1981",
          "1982",
          "1983",
          "1984",
          "1985",
          "1986",
          "1987",
          "1988",
          "1989",
          "1990",
          "1991",
          "1992",
          "1993",
          "1994",
          "1995",
          "1996",
          "1997",
          "1998",
          "1999",
          "2000",
          "2001",
          "2002",
          "2003",
          "2004",
          "2005",
          "2006",
          "2007",
          "2008",
          "2009",
          "2010",
          "2011",
          "2012",
          "2013",
          "2014",
          "2015",
          "2016",
          "2017",
          "2018",
          "2019",
          "2020",
          "2021",
          "2022",
          "2023",
          "2024"
        ],
        "highlights": [
          {
            "atFrame": 12,
            "atLabel": "1960",
            "entityId": "China",
            "headline": "China leads in 1960",
            "detail": "China recorded a population of 667070000 in 1960.",
            "factBox": {
              "heading": "Population Count",
              "body": "China reached 667070000 people in 1960.",
              "dateLabel": "1960",
              "wordmark": "China"
            }
          },
          {
            "atFrame": 1272,
            "atLabel": "2023",
            "entityId": "India",
            "headline": "India leads in 2023",
            "detail": "India recorded a population of 1438069596 in 2023.",
            "factBox": {
              "heading": "Population Count",
              "body": "India reached 1438069596 people in 2023.",
              "dateLabel": "2023",
              "wordmark": "India"
            }
          }
        ],
        "notes": [
          "80 bar-frames carry a held (non-observed) value forward; these are drawn for visual continuity only and are flagged held=true"
        ],
        "summary": {
          "heading": "Population",
          "value": 1450292481.25,
          "entityName": "India",
          "entityId": "india",
          "year": "2024",
          "unit": "count",
          "entities": [
            {
              "id": "india",
              "name": "India",
              "color": "#dc2626",
              "flagCode": "in"
            },
            {
              "id": "china",
              "name": "China",
              "color": "#2563eb",
              "flagCode": "cn"
            },
            {
              "id": "united-states",
              "name": "United States",
              "color": "#f59e0b",
              "flagCode": "us"
            }
          ]
        }
      }
    },
    {
      "id": "scene_ending",
      "type": "ending",
      "duration": 6,
      "title": "Global population leadership shifted from China to India over the recorded decades."
    },
    {
      "id": "scene_sources",
      "type": "source_card",
      "duration": 8,
      "title": "Sources",
      "props": {
        "sourcesLine": "Data: provided dataset"
      }
    }
  ],
  "assets": [],
  "sources": [
    {
      "url": "https://api.worldbank.org/v2/country/all/indicator/SP.POP.TOTL?format=json&per_page=20000&date=1960:2024",
      "publisher": "World Bank",
      "title": "SP.POP.TOTL",
      "publishedAt": null,
      "retrievedAt": "2026-09-21T09:47:03.254Z",
      "identifier": "wb_sp-pop-totl-all"
    }
  ]
}