{
  "version": "1.0",
  "metadata": {
    "title": "Forbes Billionaires Evolution",
    "subtitle": "2001 - 2024",
    "language": "en",
    "durationSeconds": 220,
    "rankDirection": "desc"
  },
  "canvas": {
    "width": 1920,
    "height": 1080,
    "fps": 30
  },
  "theme": {
    "background": "#000000",
    "surface": "#111111",
    "primaryText": "#ffffff",
    "secondaryText": "#a0a0a0",
    "mutedText": "#555555",
    "accent": "#e11d2e",
    "barTrack": "#1a1a1a",
    "fontFamily": "\"Eczar\", Georgia, serif"
  },
  "datasetRef": "dataset_forbes-billionaires-evolution-1997-2024-20261002135941-ne2nl1",
  "scenes": [
    {
      "id": "scene_title",
      "type": "title",
      "duration": 8,
      "title": "Forbes Billionaires Evolution",
      "subtitle": "2001 - 2024"
    },
    {
      "id": "scene_intro",
      "type": "intro",
      "duration": 25,
      "title": "Watch how the Forbes billionaires landscape shifts from 2001 to 2024.",
      "subtitle": "This data-race video tracks the evolution of billionaires over the years."
    },
    {
      "id": "scene_race_1",
      "type": "bar_race",
      "duration": 54,
      "datasetRef": "dataset_forbes-billionaires-evolution-1997-2024-20261002135941-ne2nl1",
      "props": {
        "tapeRef": "frames.json",
        "topN": 10,
        "periodLabels": [
          "2001",
          "2002",
          "2003",
          "2004",
          "2005",
          "2006",
          "2007",
          "2008",
          "2009",
          "2010",
          "2011",
          "2012",
          "2013",
          "2014",
          "2015",
          "2016",
          "2017",
          "2018",
          "2019",
          "2020",
          "2021",
          "2022",
          "2023",
          "2024"
        ],
        "highlights": [
          {
            "atFrame": 12,
            "atLabel": "2001",
            "entityId": "Abraham",
            "headline": "Abraham Leads Early",
            "detail": "Abraham starts the period with a high value of 7.",
            "factBox": {
              "heading": "Top Leader",
              "body": "Abraham holds the leading position in 2001.",
              "dateLabel": "2001",
              "wordmark": "Abraham"
            }
          }
        ],
        "notes": [
          "1122 bar-frames carry a held (non-observed) value forward; these are drawn for visual continuity only and are flagged held=true"
        ],
        "summary": {
          "heading": "Net Worth",
          "value": 4,
          "entityName": "Aarnio-Wihuri",
          "entityId": "aarnio-wihuri",
          "year": "2024",
          "unit": "count",
          "entities": [
            {
              "id": "aarnio-wihuri",
              "name": "Aarnio-Wihuri",
              "color": "#65a30d"
            },
            {
              "id": "abdalla-filho",
              "name": "Abdalla Filho",
              "color": "#4d7c0f"
            },
            {
              "id": "abele",
              "name": "Abele",
              "color": "#ea580c"
            }
          ]
        },
        "tapeRange": [
          0,
          179
        ]
      }
    },
    {
      "id": "scene_spotlight_2010",
      "type": "fact_box",
      "duration": 14,
      "title": "Abello rules the 2010s",
      "props": {
        "kicker": "THE 2010S",
        "atLabel": "2010",
        "body": "As the 2010s began, Abello led the world with 3 count. Abello was the previous decade's biggest climber, rising 14 places into the top 10.",
        "entityIds": [
          "abello",
          "abraham",
          "abramov"
        ]
      }
    },
    {
      "id": "scene_race_2",
      "type": "bar_race",
      "duration": 60,
      "datasetRef": "dataset_forbes-billionaires-evolution-1997-2024-20261002135941-ne2nl1",
      "props": {
        "tapeRef": "frames.json",
        "topN": 10,
        "periodLabels": [
          "2001",
          "2002",
          "2003",
          "2004",
          "2005",
          "2006",
          "2007",
          "2008",
          "2009",
          "2010",
          "2011",
          "2012",
          "2013",
          "2014",
          "2015",
          "2016",
          "2017",
          "2018",
          "2019",
          "2020",
          "2021",
          "2022",
          "2023",
          "2024"
        ],
        "highlights": [
          {
            "atFrame": 12,
            "atLabel": "2001",
            "entityId": "Abraham",
            "headline": "Abraham Leads Early",
            "detail": "Abraham starts the period with a high value of 7.",
            "factBox": {
              "heading": "Top Leader",
              "body": "Abraham holds the leading position in 2001.",
              "dateLabel": "2001",
              "wordmark": "Abraham"
            }
          }
        ],
        "notes": [
          "1122 bar-frames carry a held (non-observed) value forward; these are drawn for visual continuity only and are flagged held=true"
        ],
        "summary": {
          "heading": "Net Worth",
          "value": 4,
          "entityName": "Aarnio-Wihuri",
          "entityId": "aarnio-wihuri",
          "year": "2024",
          "unit": "count",
          "entities": [
            {
              "id": "aarnio-wihuri",
              "name": "Aarnio-Wihuri",
              "color": "#65a30d"
            },
            {
              "id": "abdalla-filho",
              "name": "Abdalla Filho",
              "color": "#4d7c0f"
            },
            {
              "id": "abele",
              "name": "Abele",
              "color": "#ea580c"
            }
          ]
        },
        "tapeRange": [
          180,
          379
        ]
      }
    },
    {
      "id": "scene_spotlight_2020",
      "type": "fact_box",
      "duration": 14,
      "title": "Aarnio-Wihuri rules the 2020s",
      "props": {
        "kicker": "THE 2020S",
        "atLabel": "2020",
        "body": "As of 2024, Aarnio-Wihuri leads the world with 4 count.",
        "entityIds": [
          "aarnio-wihuri",
          "abdalla-filho",
          "abele"
        ]
      }
    },
    {
      "id": "scene_race_3",
      "type": "bar_race",
      "duration": 30,
      "datasetRef": "dataset_forbes-billionaires-evolution-1997-2024-20261002135941-ne2nl1",
      "props": {
        "tapeRef": "frames.json",
        "topN": 10,
        "periodLabels": [
          "2001",
          "2002",
          "2003",
          "2004",
          "2005",
          "2006",
          "2007",
          "2008",
          "2009",
          "2010",
          "2011",
          "2012",
          "2013",
          "2014",
          "2015",
          "2016",
          "2017",
          "2018",
          "2019",
          "2020",
          "2021",
          "2022",
          "2023",
          "2024"
        ],
        "highlights": [
          {
            "atFrame": 12,
            "atLabel": "2001",
            "entityId": "Abraham",
            "headline": "Abraham Leads Early",
            "detail": "Abraham starts the period with a high value of 7.",
            "factBox": {
              "heading": "Top Leader",
              "body": "Abraham holds the leading position in 2001.",
              "dateLabel": "2001",
              "wordmark": "Abraham"
            }
          }
        ],
        "notes": [
          "1122 bar-frames carry a held (non-observed) value forward; these are drawn for visual continuity only and are flagged held=true"
        ],
        "summary": {
          "heading": "Net Worth",
          "value": 4,
          "entityName": "Aarnio-Wihuri",
          "entityId": "aarnio-wihuri",
          "year": "2024",
          "unit": "count",
          "entities": [
            {
              "id": "aarnio-wihuri",
              "name": "Aarnio-Wihuri",
              "color": "#65a30d"
            },
            {
              "id": "abdalla-filho",
              "name": "Abdalla Filho",
              "color": "#4d7c0f"
            },
            {
              "id": "abele",
              "name": "Abele",
              "color": "#ea580c"
            }
          ]
        },
        "tapeRange": [
          380,
          479
        ]
      }
    },
    {
      "id": "scene_ending",
      "type": "ending",
      "duration": 15,
      "title": "The rankings highlight the ongoing evolution of Forbes Billionaires Evolution through 2024."
    }
  ],
  "assets": [],
  "sources": [
    {
      "url": "https://www.kaggle.com/datasets/guillemservera/forbes-billionaires-1997-2023",
      "publisher": "kaggle.com",
      "publishedAt": null,
      "retrievedAt": "2026-10-02T13:59:46.585Z",
      "identifier": "picked_https-www-kaggle-com-datasets-guillemservera-forbes-billiona"
    }
  ]
}